{
  "schema_version": 1,
  "ticket_id": "GOV-001",
  "markdown_heading": "## GOV-001 — 2026-04-11T21:46:20.412Z",
  "startup_checklist": [
    "completed"
  ],
  "traceability_gate": [
    "exempt"
  ],
  "governance": {
    "expected_closeout": {
      "method": "no_pr",
      "base_ref": "main",
      "provenance_note": "local-review (no PR); operator-model design recorded in coord/GOVERNANCE_ARCHITECTURE.md, coord/AGENT_PATHS.md, coord/VERB_CONTRACT.md, and coord/AGENT_CAPABILITY_REGISTRY.md"
    },
    "review_profile": "standard",
    "ticket_local_repairs": []
  },
  "review_round": 1,
  "baseline_reproduction": [
    "TODO: Command: <required for test/contract/infra tickets; otherwise mark not-required>",
    "TODO: Outcome: <required for test/contract/infra tickets; otherwise mark not-required>"
  ],
  "prior_findings": [],
  "intended_files": [
    "coord/GOVERNANCE_ARCHITECTURE.md",
    "coord/AGENT_PATHS.md",
    "coord/VERB_CONTRACT.md",
    "coord/AGENT_CAPABILITY_REGISTRY.md"
  ],
  "change_summary": [
    "Define the template operator model around a small human-facing command surface, comparative-strength dispatch, and a clear boundary between facade UX, agent-native execution, and the governed CLI/MCP core."
  ],
  "verification_commands": [
    "node coord/board/board.js validate",
    "rg -n 'agent next|agent do <ticket>|Facade owns UX|coord/scripts/agent|Comparative-Advantage Dispatch|capability registry' coord/GOVERNANCE_ARCHITECTURE.md coord/AGENT_PATHS.md coord/VERB_CONTRACT.md coord/AGENT_CAPABILITY_REGISTRY.md"
  ],
  "critical_invariants": [
    "The human-facing operator model stays small while lifecycle correctness remains in the shared governance core.",
    "Agent-native wrappers and ecosystems remain adapters above the same canonical board, lock, evidence, and recovery model."
  ],
  "requirement_closure": [
    "Ticket ask: Define the governed operator model: a small human-facing command surface, mandate-based dispatch, a shared CLI/MCP core, and the boundary between facade UX, agent-native execution, and canonical governance state.",
    "Implemented: Defined the target-state governance architecture, the shared/native agent path model, the neutral verb contract, and the starter capability-registry baseline for Claude, Codex, and Gemini.",
    "Not implemented: The neutral facade executable and runtime registry automation are not built yet; those remain follow-on implementation work under GOV-009 and GOV-010.",
    "Deferred to: GOV-009, GOV-010",
    "Closeout verdict: complete"
  ],
  "feature_proof": [
    "path:GOVERNANCE_ARCHITECTURE.md",
    "path:AGENT_PATHS.md",
    "path:VERB_CONTRACT.md",
    "path:AGENT_CAPABILITY_REGISTRY.md"
  ],
  "repo_gates": [
    "not-required"
  ],
  "self_review_cycles": [
    {
      "cycle": 1,
      "total": 3,
      "lens": "contract-state",
      "diff": "Defined the operator-model contract across governance architecture, native-path guidance, and the neutral verb surface, then clarified the current-state versus target-state boundary for the facade.",
      "risks": [
        "The template could overstate unimplemented facade behavior if target-state and current-state are not separated clearly.",
        "Different agent shims could drift if the shared operator model is not described once at the architecture and path-selection levels."
      ],
      "findings": "none",
      "verification": "rg -n 'Current Implementation Boundary|agent next|coord/scripts/agent|Neutral Verb Contract' coord/GOVERNANCE_ARCHITECTURE.md coord/AGENT_PATHS.md coord/VERB_CONTRACT.md",
      "verdict": "pass",
      "raw": "lens=contract-state; diff=Defined the operator-model contract across governance architecture, native-path guidance, and the neutral verb surface, then clarified the current-state versus target-state boundary for the facade.; risks=The template could overstate unimplemented facade behavior if target-state and current-state are not separated clearly., Different agent shims could drift if the shared operator model is not described once at the architecture and path-selection levels.; findings=none; verification=rg -n 'Current Implementation Boundary|agent next|coord/scripts/agent|Neutral Verb Contract' coord/GOVERNANCE_ARCHITECTURE.md coord/AGENT_PATHS.md coord/VERB_CONTRACT.md; verdict=pass"
    },
    {
      "cycle": 2,
      "total": 3,
      "lens": "auth-security-failure",
      "diff": "Kept governance correctness in the shared CLI/MCP core and explicitly left agent-native wrappers as adapters so provider-specific paths cannot become shadow authorities.",
      "risks": [
        "Prompt or wrapper guidance could silently take over lifecycle authority if the boundary with the governed core is vague.",
        "Comparative-strength dispatch could flatten into agent favoritism instead of an explicit",
        "reviewable routing rule."
      ],
      "findings": "none",
      "verification": "rg -n 'Engine owns correctness|Agent owns cognition|CLI and MCP harmonize the core|Native ecosystems stay native|Dispatch Rule' coord/GOVERNANCE_ARCHITECTURE.md coord/AGENT_CAPABILITY_REGISTRY.md",
      "verdict": "pass",
      "raw": "lens=auth-security-failure; diff=Kept governance correctness in the shared CLI/MCP core and explicitly left agent-native wrappers as adapters so provider-specific paths cannot become shadow authorities.; risks=Prompt or wrapper guidance could silently take over lifecycle authority if the boundary with the governed core is vague., Comparative-strength dispatch could flatten into agent favoritism instead of an explicit, reviewable routing rule.; findings=none; verification=rg -n 'Engine owns correctness|Agent owns cognition|CLI and MCP harmonize the core|Native ecosystems stay native|Dispatch Rule' coord/GOVERNANCE_ARCHITECTURE.md coord/AGENT_CAPABILITY_REGISTRY.md; verdict=pass"
    },
    {
      "cycle": 3,
      "total": 3,
      "lens": "tests-operability-performance",
      "diff": "Turned the capability registry into a usable template baseline by replacing blank placeholder rows with actual starter entries for Claude, Codex, and Gemini, while preserving later project refinement.",
      "risks": [
        "A placeholder-only registry would make comparative-strength dispatch nominal instead of actionable.",
        "Over-specifying per-project truth in the template would create a false sense of provider capability certainty."
      ],
      "findings": "none",
      "verification": "rg -n 'Yes: .*CLAUDE\\.md|Yes: .*CODEX\\.md|Yes: .*GEMINI\\.md|template baseline' coord/AGENT_CAPABILITY_REGISTRY.md",
      "verdict": "pass",
      "raw": "lens=tests-operability-performance; diff=Turned the capability registry into a usable template baseline by replacing blank placeholder rows with actual starter entries for Claude, Codex, and Gemini, while preserving later project refinement.; risks=A placeholder-only registry would make comparative-strength dispatch nominal instead of actionable., Over-specifying per-project truth in the template would create a false sense of provider capability certainty.; findings=none; verification=rg -n 'Yes: .*CLAUDE\\.md|Yes: .*CODEX\\.md|Yes: .*GEMINI\\.md|template baseline' coord/AGENT_CAPABILITY_REGISTRY.md; verdict=pass"
    }
  ],
  "rollback_strategy": [
    "Revert the operator-model design docs to the previous scaffold language if the template decides not to standardize the facade, dispatch, and capability-registry contract at the governance level."
  ],
  "security_surface": "no",
  "synced_from_markdown_at": "2026-04-11T21:46:20.412Z"
}
